{"status": "success", "message": "Patient intake form submitted successfully", "patient_data": {"fullName": "Nitesh", "age": "26", "gender": "male", "contact": "7973935354", "email": "niteshguptabrs@gmail.com", "mainSymptoms": "Bahut jyada", "symptomTriggers": "cold", "symptomRelief": "rest", "pastIllnesses": "sinus", "currentMedications": "vitamin D", "familyHistory": "father", "allergies": "pollen", "diet": "vegan", "sleep": "6", "exercise": "30", "environment": "live", "emotionalState": "irritatble", "stressors": "jobloss", "mentalSymptoms": "forgetful", "temperature": "prefers_warm", "foodPreferences": "sweet", "timeOfDay": "morning", "doctorObservations": "anxious", "suspectedOrgan": "liver", "relatedBodyParts": "stomach", "diagnosisNotes": "chronic fatig", "prescribedRemedy": "sulphur"}, "patient_summary": "PATIENT: Nitesh\nAge: 26\nGender: male\n\nCHIEF COMPLAINTS:\nBahut jyada\n\nSYMPTOM TRIGGERS:\ncold\n\nSYMPTOM RELIEF FACTORS:\nrest\n\nMEDICAL HISTORY:\nPast Illnesses: sinus\nCurrent Medications: vitamin D\nFamily History: father\nAllergies: pollen\n\nLIFESTYLE FACTORS:\nDiet: vegan\nSleep: 6\nExercise: 30\nEnvironment: live\n\nMENTAL/EMOTIONAL STATE:\nEmotional State: irritatble\nStressors: jobloss\nMental Symptoms: forgetful\n\nCONSTITUTIONAL FACTORS:\nTemperature Preference: prefers_warm\nFood Preferences: sweet\nSymptom Pattern: Worse during morning\n\nDOCTOR'S ASSESSMENT:\nObservations: anxious\nSuspected System: liver\nAffected Areas: stomach\nDiagnosis Notes: chronic fatig\nPrescribed Remedy: sulphur"}